<?xml version="1.0" encoding="UTF-8"?>

<!--
    Document   : transit-frame-to-xml.xml
    Created on : June 16, 2004, 4:20 PM
    Author     : timf
    Description:
        Purpose of the document follows.
-->

<!DOCTYPE config SYSTEM '/home/timf/xml-config.dtd'>
<config>
 <head>
    <identifier><dtd><system>transit-something-to-xml-converter.dtd</system>
    </dtd></identifier>
    <file-type>Transit TTF xml files</file-type>
    <file-type-description>These are XML files generated by transit</file-type-description>
    <author>Tim Foster</author>
    <generated-by>Tim Foster - would be nice to have a machine do this in the future though</generated-by>
    <generated-date>Wednesday, June 16th</generated-date>
    <last-modified-date>Friday, January 21st</last-modified-date>
 </head>
 <body>
    <config-element translatable="yes" hardness="hard">p</config-element>
    <config-element translatable="yes" hardness="inline">b</config-element>
    <config-element translatable="yes" hardness="inline">i</config-element>
    <config-element translatable="yes" hardness="inline">XRef</config-element>
    <config-element translatable="yes" hardness="inline">Idx</config-element>
    <config-element translatable="yes" hardness="inline">BmkPoint</config-element>
    <config-element translatable="yes" hardness="inline">Frm</config-element>
    <config-element translatable="yes" hardness="inline">Variable</config-element>
    <config-element translatable="yes" hardness="inline">F</config-element>
 </body>
</config>
