<?xml version="1.0"?>
<!DOCTYPE config SYSTEM "xml-config.dtd">
<config>
<head>
<identifier>
<dtd>
<system>map_1_0.dtd</system>
<public>-//Sun Microsystems Inc.//DTD JavaHelp Map Version 1.0//EN</public>
</dtd>
</identifier>
<file-type>JavaHelp Map</file-type>
<file-type-description>JavaHelp Map file</file-type-description>
<author>Tim Foster</author>
<generated-by>Tim Foster</generated-by>
<generated-date>1st June 2005</generated-date>
<last-modified-date>1st June 2005</last-modified-date>
</head>

<body>
<!-- nothing translatable in here -->
</body>
</config>
