<?xml version="1.0"?>
<!DOCTYPE config SYSTEM "xml-config.dtd">
<config>
<head>
<namespace>http://www.w3.org/1999/02/22-rdf-syntax-ns#</namespace>
<file-type>W3C RDF documents, as used by Mozilla</file-type>
<file-type-description>This is a test xml config file for these types of document</file-type-description>
<author>Tim Foster</author>
<generated-by>Manually written xml config file</generated-by>
<generated-date>06/Apr/2005</generated-date>
<last-modified-date>06/Apr/2005</last-modified-date>
</head>
<body>
<config-element translatable="yes" hardness="hard">Description</config-element>
</body>
</config>
