<?xml version="1.0"?>
<!DOCTYPE config SYSTEM "xml-config.dtd">
<config>
<head>
<identifier>
<dtd>
<system>index_1_0.dtd</system>
<public>-//Sun Microsystems Inc.//DTD JavaHelp Index Version 1.0//EN</public>
</dtd>
</identifier>
<file-type>JavaHelp Index</file-type>
<file-type-description>JavaHelp Index file</file-type-description>
<author>Tim Foster</author>
<generated-by>Tim Foster</generated-by>
<generated-date>1st June 2005</generated-date>
<last-modified-date>1st June 2005</last-modified-date>
</head>

<body>
<config-element translatable="yes" hardness="hard">indexitem</config-element>
<config-attribute translatable="yes" parent-element="indexitem">text</config-attribute>
</body>
</config>
